{"apiVersion":"kernel-zero.dev/custody/v1","approval":{"approvalId":"0195f000-0000-7000-8000-000000000012","approvedAt":"2026-01-15T12:00:00.000Z","digest":"sha256:3333333333333333333333333333333333333333333333333333333333333333"},"findings":[{"code":"CUSTODY_AUTHORITY_TIME_INVALID","message":"The approval signing authority was not authorized at the signed approval time.","subject":"authority:workspace-authority-1"}],"integrity":{"algorithm":"sha256","digest":"sha256:1e987f802729df6f51e58097f1b90971f7a02b58f56fb2a4b6f2bfffeebdaed4"},"kind":"PolicyCustodyEvidence","policy":{"digest":"sha256:1111111111111111111111111111111111111111111111111111111111111111","kind":"RepositoryPolicy","name":"service-boundaries","revision":1},"result":{"errors":1,"status":"fail"},"tool":{"name":"kernel-zero-validator","version":"1.0.0"},"trust":{"digest":"sha256:5555555555555555555555555555555555555555555555555555555555555555","keyId":"workspace-authority-1","revision":1},"workspace":"0195f000-0000-7000-8000-000000000002"}
